nom,prix,lien,boutique,prix_numerique
Protection de cadre Extreme Padel,"3,90 €",https://www.extreme-padel.fr/protections-padel/20109-protection-de-cadre-extreme-padel.html,Extreme Padel,3.9
Gel TIVA Ultimate Dry Grip,"23,00 € ",https://www.extreme-padel.fr/anti-transpirant-main/21570-gel-tiva-ultimate-dry-grip.html,Extreme Padel,23.0
Manchon de compression Floky NO-STRAIN Noir,"39,00 € ",https://www.extreme-padel.fr/compression/21592-manchon-de-compression-floky-no-strain-noir.html,Extreme Padel,39.0
Manchon de compression Floky NO-STRAIN X Agustín Tapia,"33,90 € ",https://www.extreme-padel.fr/compression/21597-manchon-de-compression-floky-no-strain-x-agustin-tapia.html,Extreme Padel,33.9
Manchon de compression Floky NO-STRAIN Blanc,"39,00 € ",https://www.extreme-padel.fr/compression/21591-manchon-de-compression-floky-no-strain-blanc.html,Extreme Padel,39.0
Surgrips Dunlop Gecko Tac Noir x 3,"8,99 € ",https://www.extreme-padel.fr/grips-de-padel/19563-surgrips-dunlop-gecko-tac-noir-x-3.html,Extreme Padel,8.99
Serviette Prince x Smiley Noir / Jaune,"24,95 € ",https://www.extreme-padel.fr/serviettes-de-padel/22154-serviette-prince-x-smiley-noir-jaune.html,Extreme Padel,24.95
Surgrips Bullpadel Comfort Orange x 3,"6,95 € ",https://www.extreme-padel.fr/grips-de-padel/15871-surgrips-bullpadel-comfort-orange-x-3.html,Extreme Padel,6.95
Protection Bullpadel Frame Pro Protector x2,"14,90 €",https://www.extreme-padel.fr/protections-padel/20761-protection-bullpadel-frame-pro-protector-x2.html,Extreme Padel,14.9
Surgrips Wilson Pro Sensation Overgrip Blanc x 3,"9,50 € ",https://www.extreme-padel.fr/grips-de-padel/16524-surgrips-wilson-pro-sensation-overgrip-blanc-x-3.html,Extreme Padel,9.5
Spray Collant TotalGrip 4ON,"27,00 € ",https://www.extreme-padel.fr/anti-transpirant-main/16379-spray-collant-totalgrip-4on.html,Extreme Padel,27.0
Surgrips Babolat VS Original Noir x 3,"8,95 € ",https://www.extreme-padel.fr/grips-de-padel/15634-surgrips-babolat-vs-original-noir-x-3.html,Extreme Padel,8.95
Grip Wilson Pro Performance Noir,"9,00 € ",https://www.extreme-padel.fr/grips-de-padel/10720-grip-wilson-pro-performance-noir.html,Extreme Padel,9.0
Grip Bullpadel Hesacore Blanc,"20,00 € ",https://www.extreme-padel.fr/grips-de-padel/11997-grip-bullpadel-hesacore-blanc.html,Extreme Padel,20.0
Chaussettes de compression Floky S-MASH 3D Blanc,"36,90 € ",https://www.extreme-padel.fr/compression/21608-chaussettes-de-compression-floky-s-mash-3d-blanc.html,Extreme Padel,36.9
Grip Head Hydrosorb Noir,"9,00 € ",https://www.extreme-padel.fr/grips-de-padel/28-grip-head-hydrosorb-noir.html,Extreme Padel,9.0
Grip Babolat Syntec Team Blanc,"7,95 € ",https://www.extreme-padel.fr/grips-de-padel/14742-grip-babolat-syntec-team-blanc.html,Extreme Padel,7.95
Surgrips Babolat Pro Response Noir x 3,"8,95 €",https://www.extreme-padel.fr/grips-de-padel/20429-surgrips-babolat-pro-response-noir-x-3.html,Extreme Padel,8.95
Surgrips Bullpadel Comfort Blanc x 3,"6,95 € ",https://www.extreme-padel.fr/grips-de-padel/12066-surgrips-bullpadel-comfort-blanc-x-3.html,Extreme Padel,6.95
Surgrips Babolat Pro Response Blanc x 3,"8,95 €",https://www.extreme-padel.fr/grips-de-padel/20439-surgrips-babolat-pro-response-blanc-x-3.html,Extreme Padel,8.95
Grip Head Hydrosorb Pro Noir,"9,00 € ",https://www.extreme-padel.fr/grips-de-padel/7492-grip-head-hydrosorb-pro-noir.html,Extreme Padel,9.0
Chaussettes de compression Floky S-MASH 3D Noir,"36,90 € ",https://www.extreme-padel.fr/compression/21610-chaussettes-de-compression-floky-s-mash-3d-noir.html,Extreme Padel,36.9
Grip Babolat Syntec Uptake Noir,"5,95 € ",https://www.extreme-padel.fr/grips-de-padel/14780-grip-babolat-syntec-uptake-noir.html,Extreme Padel,5.95
Lotion Prince Grip Plus,"14,00 € ",https://www.extreme-padel.fr/14027-lotion-prince-grip-plus.html,Extreme Padel,14.0
Porte clé Head Logo,"5,00 €",https://www.extreme-padel.fr/goodies-padel/21696-porte-cle-head-logo.html,Extreme Padel,5.0
Surgrips Babolat Pro Tour 2.0 Blanc x 3,"8,95 € ",https://www.extreme-padel.fr/grips-de-padel/19810-surgrips-babolat-pro-tour-20-blanc-x-3.html,Extreme Padel,8.95
Gel Bullpadel Dry Grip,"16,99 € ",https://www.extreme-padel.fr/anti-transpirant-main/20089-gel-bullpadel-dry-grip.html,Extreme Padel,16.99
Serviette Head,"21,00 € ",https://www.extreme-padel.fr/serviettes-de-padel/13491-serviette-head.html,Extreme Padel,21.0
Manchon de compression Floky NO-STRAIN Jaune,"39,00 € ",https://www.extreme-padel.fr/compression/21593-manchon-de-compression-floky-no-strain-jaune.html,Extreme Padel,39.0
Manchon de compression Floky NO-STRAIN Bali Bleu,"26,90 € ",https://www.extreme-padel.fr/compression/21596-manchon-de-compression-floky-no-strain-bali-bleu.html,Extreme Padel,26.9
Grip Bullpadel Hesacore Gel,"22,99 € ",https://www.extreme-padel.fr/grip,Extreme Padel,22.99
Surgrip de Tennis Padel Bullpadel GB1200 971,7.50 €,https://equipement-padel.com/products/surgrip-de-tennis-padel-bullpadel-gb1200-971,Equipement Padel,750.0
Sac de Sport Padel Bullpadel BPP-23012 Hack 03 Noir,82.90 €,https://equipement-padel.com/products/sac-de-sport-padel-bullpadel-bpp-23012-hack-03-noir,Equipement Padel,8290.0
Sac de Sport Padel Bullpadel 23014 Perfor Noir,57.80 €,https://equipement-padel.com/products/sac-de-sport-padel-bullpadel-23014-perfor-noir,Equipement Padel,5780.0
Sac de Sport Padel Bullpadel BPP-23001 Vert,74.00 €,https://equipement-padel.com/products/sac-de-sport-padel-bullpadel-bpp-23001-vert,Equipement Padel,7400.0
Sac de Sport Padel Bullpadel BPP-23006 Orange,60.70 €,https://equipement-padel.com/products/sac-de-sport-padel-bullpadel-bpp-23006-orange,Equipement Padel,6070.0
Sac de Sport Padel Bullpadel BPP-23019 Noir,65.00 €,https://equipement-padel.com/products/sac-de-sport-padel-bullpadel-bpp-23019-noir,Equipement Padel,6500.0
Sac de Sport Padel Bullpadel BPP-23012 Jaune,87.80 €,https://equipement-padel.com/products/sac-de-sport-padel-bullpadel-bpp-23012-jaune,Equipement Padel,8780.0
Sac de Sport Padel Bullpadel BPP-23018 Dc Hack Noir,15.70 €,https://equipement-padel.com/products/sac-de-sport-padel-bullpadel-bpp-23018-dc-hack-noir,Equipement Padel,1570.0
Sac de Sport Padel Bullpadel BPP-23008 D.Case Corail,16.20 €,https://equipement-padel.com/products/sac-de-sport-padel-bullpadel-bpp-23008-d-case-corail,Equipement Padel,1620.0
Visière Buff Zat Bleu Noir,19.80 €,https://equipement-padel.com/products/visiere-buff-zat-bleu-noir,Equipement Padel,1980.0
Visière Buff Solid Blanc,23.70 €,https://equipement-padel.com/products/visiere-buff-solid-blanc,Equipement Padel,2370.0
Visière Buff Xcross Bleu,19.80 €,https://equipement-padel.com/products/visiere-buff-xcross-bleu,Equipement Padel,1980.0
Sac de Sport Padel Wilson Team Rouge,68.40 €,https://equipement-padel.com/products/sac-de-sport-padel-wilson-team-rouge,Equipement Padel,6840.0
Sac de Sport Padel Drop Shot Airam JMD Noir,119.50 €,https://equipement-padel.com/products/sac-de-sport-padel-drop-shot-airam-jmd-noir,Equipement Padel,11950.0
Sac de Sport Padel Drop Shot Essential 23 Noir,42.30 €,https://equipement-padel.com/products/sac-de-sport-padel-drop-shot-essential-23-noir-2,Equipement Padel,4230.0
Protecteur Starvie PT23A Bleu Noir,9.70 €,https://equipement-padel.com/products/protecteur-starvie-pt23a-noir,Equipement Padel,970.0
Sac à dos de Sport Wilson Team Rouge,53.40 €,https://equipement-padel.com/products/sac-a-dos-de-sport-wilson-team-rouge,Equipement Padel,5340.0
Sac de Sport Padel Bullpadel BPP-23014 Noir,57.80 €,https://equipement-padel.com/products/sac-de-sport-padel-bullpadel-bpp-23014-noir,Equipement Padel,5780.0
Sac de Sport Padel Bullpadel BPP-23008 D.Case Kaki,15.70 €,https://equipement-padel.com/products/sac-de-sport-padel-bullpadel-bpp-23008-d-case-kaki,Equipement Padel,1570.0
Visière Endless Icon Noir Taille unique,22.40 €,https://equipement-padel.com/products/visiere-endless-icon-noir,Equipement Padel,2240.0
Sac de Sport Padel Asics 3043A008-402 Orange,82.70 €,https://equipement-padel.com/products/sac-de-sport-padel-asics-3043a008-402-orange,Equipement Padel,8270.0
Disco 141293 (50 Unités),149.60 €,https://equipement-padel.com/products/disco-141293-50-unites,Equipement Padel,14960.0
Sac de Sport Padel Softee TEAM 14015 Bleu,60.30 €,https://equipement-padel.com/products/padel-bag-softee-team-14015-blue,Equipement Padel,6030.0
